docName,labelText,valuesText,numValuesdoc1_Research_identificat,search inquiri research identif recognit design explor enquiri,,1000doc1_Frozen_identificatio,suspend immobil frosti wintri dead down design immobilis still out freez ici fix flash identif recognit glacial stock stop frigid frozen quick root block,,1000doc1_Trial_identification,run recognit visit identif trial design tribul tryout test,,1000doc1_FFPE_identification,identif recognit design ffpe,,1000doc1_Tumor_Source,origin tumour sourc reservoir author gener begin germ tumor inform neoplasm rootag root seed refer,perenni mucosa secondli touch suffer fit elementari contermin adjoin main match get rake rakehel bit recurr roue 2d princip side fulfil encount stemma back second sec quill contigu pattern formula across ancestri run parentag lineag met base come by on instant irregular of converg s neighbor origin endors elect conform proflig into 2nd lung membran primari convent to next adjac master feather gear cope basal togeth line with mo indors forgath meet minut rip bloodlin pedigre assembl descent receiv satisfi take fill stock play repeat see normal arcsecond moment blood coil foregath mucou gather rule element chief contact wind,9doc1_Procurement,procur,suspend immobil frosti wintri dead down immobilis still out freez ici fix flash glacial oct stock ffpe stop frigid octob frozen quick root block,3doc1_RNA_isolation,off rna isol ribonucl close acid,origin stemma hark proflig back rip paxgen return bloodlin purelink in invitrogen acid pedigre reminisc descent come call rememb roue stock ancestri recal parentag rna rake rneasi kit lineag blood qiagen line echo ambion retriev outfit of up recollect callback withdraw ribonucl out think rakehel,4doc1_Amplification,amplif gain elabor,ane trio one ii terzetto uniti tercet deuc nugen three triniti 1 3 2 trine singl triplet ffpe troika threesom beta two iii ternion ternari ace i genu trey tierc triad leash,5doc1_Affy_Microarray,microarray affi,,1000doc1_HPV_Stat,stat hpv,polonium neg offic us number state petti 84 atom post river po unit,2doc1_Diagnosis_Date,appoint stamp engag diagnos of diagnosi month go see escort particular date the steadi day out,,1000doc1_Recurrence_Date,appoint return engag stamp of day go see escort particular date the month steadi recurr out,,1000doc1_Death_Date,engag month see demis go out death end stamp escort particular date day expiri appoint last deceas of destruct die the steadi,,1000doc1_date_of_last_follow_,conform stop engag point over lastli surviv fini astir see cobbler follow go close pursu abreast abid out death end in stamp with travel day upwardli to live espous take escort endur shoemak termin fall final lowest be play finish an trace eye month conclud net after watch surveil compli succeed accompani stick particular date utmost along hold come by conclus stage appoint on postdat last survey of adopt up keep s place improv the steadi observ upward,,1000doc1_Age_At_diagnosis,on matur geezerhood astatin get diagnos year age atom diagnosi histor long period old senesc at time number eld 85,,1000doc1_Ethnicity,ethnic,atom number westward tungsten bacillu barn group west doubl due complex 5 8 type wolfram vitamin 74 boron watt b oxygen bel o u w,3doc1_SEX,excit on urg practic gender activ up sex turn arous sexual wind,metr chiliad number meter one fluorin concentr farad mib megabyt fahrenheit grand 9 thousand atom molar yard g f thou mebibyt k mb m degre 1000,2doc1_tumor_subsite,tumor tumour neoplasm subsit,elect elementari obscur 50 alien quantiti primari quill fifti unknown chief litr master feather main liter cubic lambert hp terra basal decimetr unsung unidentifi coil strang horsepow stranger region oc l element incognita princip wind nameless unnam decimet op,5doc1_Cancer_FHx,diseas cancer neoplast genu malign fhx crab the,northward yttrium north 7 normal 39 newton due n wye nitrogen atom y number,2doc1_Tobacco,plant tobacco bacci,pyr,1000doc1_EtOH,etoh,northward yttrium north 7 normal 39 newton due n wye nitrogen atom y number,2doc1_clinical_stage_at_di,number level diagnos point diagnosi degre repres arrang clinic at microscop atom phase astatin stagecoach 85 leg present stage,ane trio one ii littl uniti tercet tetrad deuc foursom three triniti 1 3 2 4 ternari singl trine triplet terzetto quadruplet troika threesom quaternion two iv iii ternion four ace quaternari i trey tierc quatern triad leash quartet joe,4doc1_Clinical_TNM_at_diag,diagnos diagnosi number clinic at atom tnm astatin 85,t3n txn t1n t4n t2n,1000doc1_path_stage_at_diagno,point diagnos diagnosi number repres at microscop stagecoach 85 cours rout way life leg track arrang atom phase path present stage itinerari level of degre astatin,ane trio one ii littl uniti tercet tetrad deuc foursom three triniti 1 3 2 4 ternari singl trine triplet terzetto quadruplet troika threesom quaternion two iv iii ternion four ace quaternari i trey tierc quatern triad leash quartet joe,4doc1_Path_TNM_at_diagnosi,life cours itinerari astatin track of rout diagnosi number diagnos at way atom tnm path 85,t3n txn t1n t4n t2n,1000doc1_Path_Diff,life cours itinerari track of rout way diff path,consider advantag modern pitiabl substanti intim piteou comfort wretch modernist fountainhead poor good wellspr peopl swell hapless miser mod short pathet misfortun well piti easili inadequ,3doc1_Primary_Therapy,therapi elect elementari chief element basal princip master wind coil feather main primari quill,ohm reciproc entropi ane intellig atom number one second nineti sec ic unit uniti commun southward due 1 iodin state sulfur singl random nation 99 xrt sulphur mho ace 16 i 53 ccr siemen s nine south,5doc1_Rec,rec,no ye number nobelium atom 102 more,2doc1_Disease_state,commonwealth depart say publica unit submit re state forward tell polit do diseas provinc express nation bodi put land of matter posit countri,depart of ned dod state awd defens unit,3doc1_Distant_Local,upstag anesthet remot remov anaesthet topic distant aloof local,upstag anesthet remot remov anaesthet topic distant aloof local,2doc1_Rec_Location,emplac fix localis posit rec local placement locat,leftfield forget over cuti bequeath scrape skin go depart suffer shinni fit ln behind color adjoin sputter exit main forgath match to get osseou leftov princip locoregion bone fulfil encount touch see result pass bark odd quill out hide lead pelt away axillari mug leav impart rec forth across run tegument peel satisfi met come swot on drum togeth alon struggl converg os elect conform elementari into trachea lung primari oesophagu debon esophagu pearl master cram feather unexpend pare cope basal ivori liver gorg with white gullet pull provid up will remain meet shin give element fill assembl receiv stake windpip field take scrambl play hand clamber coil entrust foregath off for gather alar grind chief contact allow left wing wind tissu,1000doc1_Comments,comment remark point commentari gloss annot notic scuttlebutt input gossip out,,1000doc2_Tumor_HAND_identific,help deal give over handwrit player design pass tumour paw identif recognit neoplasm mitt reach hand man on hire manu script tumor turn bridg,,1000doc2_DNA_HAND_identificat,help deal give over handwrit player design pass acid dna paw identif recognit deoxyribonucl mitt reach hand desoxyribonucl man on hire manu script turn bridg,,1000doc2_MRN,mrn,,1000doc2_date_of_birth,engag give month see have deliv go out stamp escort parentag bear parturit birth particular date day appoint nascenc nativ of the steadi,,1000doc2_Date_Tissue_Harvest,engag crop month see paper go home out stamp reap glean escort weav tissu particular date harvest day appoint of time the steadi,,1000doc2_Gender_Female_Male,femal manli gender grammat distaff sex person manlik viril male sexual man,ane uniti cypher ace i nought one 1 0 zero cipher singl,2doc2_Race_Caucasian_Afric,cannonbal it asiat wash asian speed airstream languag belt subspeci pelt backwash white caucasian run slipstream african hotfoot caucas hie along caucasoid on rush hasten bucket step person american race english raceway,ane trio one ii uniti tercet deuc three triniti 1 3 2 trine singl triplet terzetto troika threesom two iii ternion ternari ace i trey tierc triad leash,3doc2_Ethnicity_Hispanic_N,non latino ethnic american spanish not hispan,ane uniti cypher ace i nought one 1 0 zero cipher singl,2doc2_Smoking_no_yes,no fume ye number nobelium smoke atom 102 more,ane uniti cypher ace i nought one 1 0 zero cipher singl,2doc2_current_Smoking_no_y,stream no fume electr ye number current nobelium smoke atom 102 flow more,ane uniti cypher ace i nought one 1 0 zero cipher singl,2doc2_Type_of_smoking_noth,chew trio nada 4pipe mastic fume deuc nail zero manduct null cigaret eccentr typecast zip jaw three triniti bacci 3 trine zippo naught type noth zilch plant triplet terzetto nil manduc troika threesom nix cipher goos butt iii fag ternion tercet case typewrit cypher aught ternari tobacco of charact trey ace tierc 5snuff smoke cigarett triad leash egg coffin 2cigar,ane trio cinqu quint one ii littl quintuplet fivesom pentad uniti tercet tetrad deuc foursom three triniti 1 3 2 5 4 phoeb ternari fin singl trine triplet terzetto quintet quadruplet troika threesom quaternion five two iv iii ternion four ace quaternari i trey tierc quatern v triad leash quartet joe,5doc2_Pack_years,load geezerhood carri coteri number down gang year old ring battalion compact long backpack wad eld day jam larg inner circl pile tamp plural take bundl multitud cliqu mob yr class throng age camp twelvemonth face time ingroup pack,,1000doc2_Date_Started,origin set depart engag pop month down see commenc go out lead stamp bulg bug start take escort forth begin get initi embark part particular date on come day appoint jump about off of up startl the protrud steadi,,1000doc2_Date_Stopped,barricad engag give over back month see blockad go check out quit end stamp arrest escort termin discontinu finish halt stop break intercept lay particular date bar hold day kibosh appoint on off of up turn contain ceas the steadi block,,1000doc2_Alcohol_no_yes,alcohol no drink ye number beverag nobelium atom 102 intoxic inebri more,ane uniti cypher ace i nought one 1 0 zero cipher singl,2doc2_Current_drinker_no_y,stream no juicer flow electr ye number toper current 102 nobelium atom drinker imbib more,ane uniti cypher ace i nought one 1 0 zero cipher singl,2doc2_age_last_alcohol,lowest geezerhood point lastli period up fini cobbler eld year go close shoemak out death end alcohol in long beverag live endur termin net final surviv matur finish get conclud drink stop inebri utmost hold old conclus stage on last age histor s senesc place time intoxic,,1000doc2_Tumor_Site_Oral_cavi,site unwritten cavum pit web tumour locat decay websit neoplasm oropharynx internet caviti viva exam hypopharynx dental situat voic larynx cari enclos examin bodili box land space voce tooth tumor place oral,ane trio one ii littl uniti tercet tetrad deuc foursom three triniti 1 3 2 4 ternari singl trine triplet terzetto quadruplet troika threesom quaternion two iv iii ternion four ace quaternari i trey tierc quatern triad leash quartet joe,4doc2_T_stage,point tetraiodothyronin metric tonn microscop stagecoach triiodothyronin thyroxin monophosph ton leg liothyronin phase repres present stage thymin level mt degre deoxythymidin t arrang,ane trio one ii littl uniti tercet tetrad deuc foursom three triniti 1 3 2 4 ternari singl trine triplet terzetto quadruplet troika threesom quaternion two iv iii ternion four joe ace quaternari i trey tierc quatern triad leash quartet 4a,5doc2_N_stage,normal northward newton north microscop point level due repres arrang phase degre nitrogen atom 7 number stagecoach n leg present stage,ane trio nought one ii zero uniti tercet deuc three triniti 1 0 3 2 trine 3b singl triplet terzetto troika threesom cipher two iii ternion cypher ternari ace i trey tierc 2a 2b 2c triad leash,8doc2_M_stage,metr point meter repres microscop stagecoach concentr mib megabyt grand leg thousand chiliad phase one present stage molar yard g level thou mebibyt k mb m degre arrang 1000,0 zero nought cipher cypher,1doc2_Date_Last_FU,engag point lastli surviv fini see cobbler in go close shoemak out death end stamp live escort endur termin net final lowest finish fu month conclud stop particular date utmost hold day conclus stage appoint on last of up s place the steadi,,1000doc2_Disease_status_at_La,depart point lastli number surviv fini finish cobbler at in go close shoemak unit 85 statu death end duc state live conclud termin net out defens lowest diseas fu nedawd endur stop condit atom utmost hold conclus stage on last of up dod final s place posit astatin,ane trio one ii littl uniti tercet tetrad deuc foursom three triniti 1 3 2 4 ternari singl trine triplet terzetto quadruplet troika threesom quaternion two iv iii ternion four ace quaternari i trey tierc quatern triad leash quartet joe,4doc2_Follow_Up_Status_On_,conform espous over an lfu follow pursu abreast abid out statu eye come travel to take condit be play fu trace after watch surveil compli succeed accompani stick fall astir along with by on postdat survey adopt up keep upwardli posit improv observ upward,ane uniti cypher ace i nought one 1 0 zero cipher singl,2doc2_Date_of_Death,engag month see demis go out death end stamp escort particular date day expiri appoint last deceas of destruct die the steadi,,1000doc2_PCR_HPV6_status_HPV6,pcr hpv6 statu posit condit,ane uniti cypher ace i nought one 1 0 zero cipher singl,2doc2_p6_p6_p6,p6,ane uniti cypher ace i nought one 1 0 zero cipher singl,2doc2_HPV6_ISH_HPV6_HPV6,hpv6 ish,ane uniti cypher ace i nought one 1 0 zero cipher singl,2doc2_HPV_status_clin_PCR_,statu mix pcr blend compound immix hpv fuse meld posit hpv6 coalesc combin unit flux clin condit merg commingl conflat aggreg,ane uniti cypher ace i nought one 1 0 zero cipher singl,2doc2_Prior_Surgery_Before,anterior oper sketch work consid contempl enter process surgeri surgic disciplin number procedur hoosier canva cogit in canvass analyz subject no front inward nobelium state enrol field written book take bailiwick inch indiana analys theatr more area hit read earlier ye befor examin atom 102 the theater room ahead of 49 recruit prior survey learn report inscrib studi medit indium or,ane uniti cypher ace i nought one 1 0 zero cipher singl,2doc2_Prior_Radiation_befo,anterior radiotherapi sketch work consid contempl enter disciplin number hoosier canva cogit in canvass hit subject no front inward nobelium state enrol field written book analyz sick inch indiana syndrom analys take area radioact therapi bailiwick read earlier ye irradi examin atom 102 the ahead befor of actinotherapi 49 recruit radiat prior medit survey learn report inscrib studi more indium,ane uniti cypher ace i nought one 1 0 zero cipher singl,2doc2_Prior_Chemotherapy_b,anterior sketch work consid contempl enter disciplin number hoosier canva cogit in canvass analyz subject no front chemotherapi nobelium state enrol field written book take bailiwick inch indiana analys more area hit read earlier ye befor examin atom 102 the inward ahead of 49 recruit prior survey learn report inscrib studi medit indium,ane uniti cypher ace i nought one 1 0 zero cipher singl,2doc2_Primary_Surgical_The,oper elect elementari surgic number primari quill no princip master nobelium feather main more therapi ye basal atom 102 coil element chief wind,ane uniti cypher ace i nought one 1 0 zero cipher singl,2doc2_Primary_radiation_Th,radiotherapi elect elementari number element primari quill syndrom no chief master nobelium sick feather main more radioact therapi ye basal irradi atom 102 coil actinotherapi radiat princip wind,ane uniti cypher ace i nought one 1 0 zero cipher singl,2doc2_Primary_chemotherapy,wind elect no elementari chemotherapi ye number element basal chief princip master nobelium atom 102 coil feather main primari quill more,ane uniti cypher ace i nought one 1 0 zero cipher singl,2doc2_Post_Surgery_Chemoth,oper situat carri surgeri surgic number procedur emili price put no chemotherapi stake send process offic station nobelium mail theatr more spot brand wiley ye berth william charl atom 102 post postal c theater room militari servic up place w posit billet or,ane uniti cypher ace i nought one 1 0 zero cipher singl,2doc2_Post_Surgery_Radioth,radiotherapi oper situat carri surgeri surgic number procedur emili price put or no stake send process offic station nobelium mail theatr more therapi spot brand wiley ye berth william irradi charl atom 102 post postal c theater room militari servic up radiat place w posit billet actinotherapi,ane uniti cypher ace i nought one 1 0 zero cipher singl,2doc2_recommendation_numbe,routin telephon number down total no enumer add identif figur nobelium passport recommend more good numer ye phone atom 102 bit come count word testimoni list up keep issu turn amount act,ane uniti cypher ace i nought one 1 0 zero cipher singl,2doc2_Datest_recommendatio,good word testimoni datest passport recommend,,1000doc2_Site_Local_no_Yes,topic land locat situat anesthet no anaesthet internet ye site number websit nobelium place web atom 102 local more,ane uniti cypher ace i nought one 1 0 zero cipher singl,2doc2_Site_Regional_no_Yes,web land locat no situat region internet ye site number websit place nobelium atom 102 more,ane uniti cypher ace i nought one 1 0 zero cipher singl,2doc2_Site_Distant_no_Yes,upstag web land locat no remot situat remov internet ye site number websit aloof distant nobelium atom 102 place more,ane uniti cypher ace i nought one 1 0 zero cipher singl,2doc2_prescription_Sur_no_,ethic medicin no prescript ye number drug nobelium sur tyre atom 102 more,ane uniti cypher ace i nought one 1 0 zero cipher singl,2doc2_prescription_Chemoth,ethic medicin no chemotherapi prescript ye number drug nobelium atom 102 more,ane uniti cypher ace i nought one 1 0 zero cipher singl,2doc2_prescription_Radioth,radiotherapi ethic therapi no actinotherapi prescript ye number drug radiat irradi medicin nobelium atom 102 more,ane uniti cypher ace i nought one 1 0 zero cipher singl,2doc2_recommendation_no_Ye,good word no recommend ye number testimoni nobelium passport atom 102 more,ane uniti cypher ace i nought one 1 0 zero cipher singl,2doc2_Date_2nd_recommendat,engag 2nd second go out stamp escort recommend good passport particular date month day appoint word testimoni of see 2d the steadi,,1000doc2_Site_Local_no_Yes,topic land locat situat anesthet no anaesthet internet ye site number websit nobelium place web atom 102 local more,ane uniti cypher ace i nought one 1 0 zero cipher singl,2doc2_Site_Regional_no_Yes,web land locat no situat region internet ye site number websit place nobelium atom 102 more,ane uniti cypher ace i nought one 1 0 zero cipher singl,2doc2_Site_Distant_no_Yes,upstag web land locat no remot situat remov internet ye site number websit aloof distant nobelium atom 102 place more,ane uniti cypher ace i nought one 1 0 zero cipher singl,2doc2_prescription_Surgery,ethic oper theater room no process surgeri prescript ye number drug or atom medicin procedur surgic 102 more theatr nobelium,ane uniti cypher ace i nought one 1 0 zero cipher singl,2doc2_prescription_chemoth,ethic medicin no chemotherapi prescript ye number drug nobelium atom 102 more,ane uniti cypher ace i nought one 1 0 zero cipher singl,2doc2_prescription_Radioth,radiotherapi ethic therapi no actinotherapi prescript ye number drug radiat irradi medicin nobelium atom 102 more,ane uniti cypher ace i nought one 1 0 zero cipher singl,2doc2_recommendation_no_Ye,good word no recommend ye number testimoni nobelium passport atom 102 more,ane uniti cypher ace i nought one 1 0 zero cipher singl,2doc2_Date_3rd_recommendat,engag tertiari month see go out 3rd stamp escort recommend good passport particular date day appoint word third testimoni of the steadi,,1000doc2_Site_Local_no_Yes,topic land locat situat anesthet no anaesthet internet ye site number websit nobelium place web atom 102 local more,ane uniti cypher ace i nought one 1 0 zero cipher singl,2doc2_Site_Regional_no_Yes,web land locat no situat region internet ye site number websit place nobelium atom 102 more,ane uniti cypher ace i nought one 1 0 zero cipher singl,2doc2_Site_Distant_no_Yes,upstag web land locat no remot situat remov internet ye site number websit aloof distant nobelium atom 102 place more,ane uniti cypher ace i nought one 1 0 zero cipher singl,2doc2_prescription_Surgery,ethic oper theater room no process surgeri prescript ye number drug or atom medicin procedur surgic 102 more theatr nobelium,ane uniti cypher ace i nought one 1 0 zero cipher singl,2doc2_prescriptionChemothe,prescriptionchemotherapi no ye number nobelium atom 102 more,ane uniti cypher ace i nought one 1 0 zero cipher singl,2doc2_prescription_Radioth,radiotherapi ethic therapi no actinotherapi prescript ye number drug radiat irradi medicin nobelium atom 102 more,ane uniti cypher ace i nought one 1 0 zero cipher singl,2doc3_Patient,affect role patient,,1000doc3_Age_years,on matur geezerhood get age year twelvemonth period long histor class senesc eld time old yr day,,1000doc3_Age_class,geezerhood grade period instruct socio eld famili year old out categori cours econom long divis assort classifi stratum sort matur form get social class on of age histor separ senesc time studi,ane uniti cypher ace i nought one 1 0 zero cipher singl,2doc3_Sex_male_female,excit on femal urg manli practic manlik gender activ up distaff sex person arous turn viril male sexual wind man,ane uniti ace i deuc two one 1 ii 2 singl,2doc3_localization_code,function codif code encrypt of fix enciph write inscrib localis cypher in comput principl local cipher locat,,1000doc3_localization_class,sort grade instruct socio famili year out divis cours locat fix econom classifi categori assort stratum local function form class of separ localis social studi principl,ane trio one ii littl uniti tercet tetrad deuc foursom three triniti 1 3 2 4 ternari singl trine triplet terzetto quadruplet troika threesom quaternion two iv iii ternion four ace quaternari i trey tierc quatern triad leash quartet joe,4doc3_pathological_T,diseas thymin patholog monophosph tetraiodothyronin metric liothyronin thyroxin tonn mt ton t deoxythymidin triiodothyronin morbid,ane trio one ii littl uniti tercet tetrad deuc foursom three triniti 1 3 2 4 ternari singl trine triplet terzetto quadruplet troika threesom quaternion two iv iii ternion four ace quaternari i trey tierc quatern triad leash quartet joe,4doc3_pathological_lymph_n,thicken point repres gland microscop stagecoach leaf guest morbid node diseas patholog leg lymph phase present stage level degre client knob arrang,ane trio one ii littl uniti tercet tetrad deuc foursom three triniti 1 3 2 4 ternari singl trine triplet terzetto quadruplet troika threesom quaternion two iv iii ternion four ace quaternari i trey tierc quatern triad leash quartet joe,4doc3_pathological_lymph_n,node thicken statu diseas leaf guest patholog posit gland client morbid lymph knob condit,ane uniti cypher ace i nought one 1 0 zero cipher singl,2doc3_pathological_stage,diseas patholog level point repres degre morbid microscop phase arrang stagecoach leg present stage,ane trio one ii littl uniti tercet tetrad deuc foursom three triniti 1 3 2 4 ternari singl trine triplet terzetto quadruplet troika threesom quaternion two iv iii ternion four ace quaternari i trey tierc quatern triad leash quartet joe,4doc3_differentiation,distinct differenti specialis special,ane trio one ii littl uniti tercet tetrad deuc foursom three triniti 1 3 2 4 ternari singl trine triplet terzetto quadruplet troika threesom quaternion two iv iii ternion four ace quaternari i trey tierc quatern triad leash quartet joe,4doc3_HPV_status,posit condit statu hpv,ane uniti cypher ace i nought one 1 0 zero cipher singl,2doc3_post_surgical_treatm,oper carri emili price stake send offic station treatment mail billet discours handl situat brand wiley spot berth william charl surgic put post postal discuss c militari servic up place w posit intervent,ethic medicin comput tomographi prescript connecticut state drug cat axial computer nutmeg constitut ct,2doc3_clinical_follow_up_m,conform espous over an clinic follow calendar pursu abreast abid out eye come travel to take survey be play trace after watch surveil compli succeed accompani stick fall astir along month with by on postdat adopt up keep upwardli improv observ upward,,1000doc3_recurrence_status_M_,metr mexico meter one nanometr concentr statu nm mib megabyt micromillimet grand new return thousand condit millimicron micromillimetr chiliad recurr molar land yard g mb thou of k m mebibyt posit 1000 enchant nanomet,ane uniti cypher ace i nought one 1 0 zero cipher singl,2doc3_distant_metastasis_f,unloosen give natur month releas unblock distant aloof gratuit rid calendar select detach disembarrass liber discharg innoc exempt disengag upstag absolv peopl endur costless free devoid dislodg grati resign destitut surviv relinquish reliev remot of remov complimentari up metastasi justifi unfreez fittest barren spare the loos unloos,,1000doc3_Actual_status_alive_,all dead anim exist in suddenli utter absolut statu perfectli activ bush live stagnant awak condit factual real liter genuin utterli beat alert short numb deaden abruptli drain actual idl posit aliv,ane uniti cypher ace i nought one 1 0 zero cipher singl,2doc3_Overall_survivalmont,suit overal survivalmonth boilersuit boiler,,1000doc3_Affymetrix_data_yes_,point datum no ye number inform atom nobelium affymetrix 102 data more,ane uniti cypher ace i nought one 1 0 zero cipher singl,2