docName,labelText,valuesText,numValuesdoc3_CGH_data_yes_no,cgh point datum no ye number inform nobelium atom 102 data more,ane uniti cypher ace i nought one 1 0 zero cipher singl,2doc3_RTPCR_data_yes_no,point datum no ye number inform rtpcr nobelium atom 102 data more,ane uniti cypher ace i nought one 1 0 zero cipher singl,2doc3_Patients_included_in,the sketch work consid contempl anticip predict disciplin number hoosier report medit in canvass hit prognost analyz subject 49 inward state forecast field written book role includ bailiwick inch nobelium analys indiana take area patient read previs ye let examin atom canva affect 102 foretel of no admit cogit survey learn studi more indium,ane uniti cypher ace i nought one 1 0 zero cipher singl,2doc3_4_gene_prediction_st,dispirit anticip four pitch line littl the humili 4 factor cistron gloomi risk previs quadruplet deplet adventur grim gami school quaternari small quartet richli blue depress statu tetrad forecast crush condit jeopardi run broken quaternion joe put miser on alexand of david foretel gene gamey first tone lowli danger height down downheart low gear infect abject mellow gambl spirit exposur peril emin up posit predict iv high chanc in cecil sir luxuri foursom take endanger prognost hazard modest mouth lay highschool humbl a scummi downcast scurvi quatern moo senior,ane uniti cypher ace i nought one 1 0 zero cipher singl,2doc3_4_genes_prediction_s,anticip predict conquest nock iv four mark sexual tetrad make grievanc foursom littl forecast grade score music 4 factor cistron hit previs quadruplet prognost quaternion joe talli account quaternari seduc up grudg quartet quatern foretel gene scotch rack,,1000doc3_Affymetrix_sample_se,typefac flesh shape human go font incas fix fig exercis under congeal local build do digit band envis enter tri coiffur grammat name showcas public localis adjust fount trope set visualis soma frame see sampl event out project pattern forecast figur estim causa correct vitrin pose subject bodi arrang put compositor lawsuit stage on solidifi of materi count s instanc place bod pillow pillowcas number coif down fanci eccentr coiff pictur solidif mark lot suit type shell fructifi form imag specifi visual case cypher prepar work up charact harden defin calcul limit posit design display comput bent readi pig cure slip rig sheath face dress gear physiqu sic circl speech encas jell countersink anatomi plant typesett distribut reckon chassi cipher lay physic affymetrix seth typeset caus exampl determin guinea tast,s3 s2 s1,3doc3_RTP_CR_sample_sets_c,typefac rtp go font 24 incas fix exercis under local do band tri coiffur grammat fount localis adjust showcas out set sampl event jell guinea causa correct vitrin pose put compositor lawsuit stage solidifi s instanc place pillow pillowcas number down cr chromium eccentr coiff solidif mark fructifi suit type shell circl specifi atom case prepar up charact harden defin limit posit arrang display bent readi pig cure slip sheath rig face dress gear sic congeal encas subject countersink plant typesett distribut lot lay coif seth typeset caus exampl determin tast,s3 s2 s1,3doc4_Filename,filenam comput name file,,1000doc4_Tu_vs_NL,cinqu 23 v nl vanadium quintet tu quint number littl volt atom vs five quintuplet fivesom phoeb 5 fin pentad,diseas cancer neoplast genu malign crab the,2doc4_Age_diagnosis,on matur geezerhood get diagnos age year diagnosi period long histor senesc eld time old,,1000doc4_Gender,gender grammat sexual sex,femal manli distaff person manlik viril male man,2doc4_Smoking_Status,posit fume statu smoke condit,onetim late previou old erstwhil stream time flow sometim quondam one current other neversmok electr earli former,3doc4_OC_vs_OP,cinqu 23 v vanadium quintet phoeb oc number littl volt atom vs five quint quintuplet fivesom 5 fin pentad op,viva exam decay pit dental space unwritten voce tooth cari oropharynx cavum examin caviti enclos oral bodili,2doc4_T_stage,point tetraiodothyronin metric tonn microscop stagecoach triiodothyronin thyroxin monophosph ton leg liothyronin phase repres present stage thymin level mt degre deoxythymidin t arrang,ane trio one ii littl uniti tercet tetrad deuc foursom three triniti 1 3 2 4 ternari singl trine triplet terzetto quadruplet troika threesom quaternion two iv iii ternion four ace quaternari i trey tierc quatern triad leash quartet joe,4doc4_cN_stage,cn level point repres degre microscop phase arrang stagecoach leg present stage,ane uniti cypher ace i deuc nought zero one 1 0 ii 2 two 2b 2c cipher singl,4doc4_pN_stage,level point repres degre microscop phase arrang stagecoach pn leg present stage,ane uniti cypher ace i nought one 1 0 zero cipher 2b 2c singl,4doc4_DM,mellitu dm diabet decimet decimetr,0 zero nought cipher cypher,1doc4_ecs,europ commun union econom ec common eu eec market european,northward yttrium north nitrogen normal 39 newton number n wye due 7 atom y,2doc4_treatment,handl discours treatment intervent discuss,ohm reciproc entropi intellig random number second nineti sec ic unit ray rt commun tube southward due state sulfur nation 99 atom sulphur mho cathod crt 16 siemen s nine south,4doc4_diagnosis_date,appoint stamp engag diagnos of diagnosi month go see escort particular date the steadi day out,,1000doc4_tx_date,appoint star engag tx stamp of lone see texa month go state escort particular date the steadi day out,,1000doc4_local_recur,repeat anesthet recur anaesthet back topic resort fall go local,ane uniti cypher ace i nought one 1 0 zero cipher singl,2doc4_local_recurdt,topic recurdt local anesthet anaesthet,,1000doc4_nodal_recur,repeat recur nodal back resort fall go,ane uniti cypher ace i nought one 1 0 zero cipher singl,2doc4_nodal_recurdt,nodal recurdt,,1000doc4_DM,mellitu dm diabet decimet decimetr,,1000doc4_DM_date,appoint dm engag stamp of particular month diabet decimetr see escort go mellitu date the steadi day decimet out,,1000doc4_survival_last_follow,lowest point natur lastli surviv fini finish cobbler follow go close shoemak select out death end in review live endur termin net final followup reexamin conclud stop utmost hold conclus stage on last of up s place the fittest,all obscur livelihood alien go utter ground absolut effort stimul strang to bush treatment endur inhabit ascrib kick earli do anim get beat break know deaden surviv discuss bread stranger die drop bad butter intervent refer dead cash pall pass fail out snuff ned exit nobelium causa experi movement be diseas perish induc abruptli reason 102 becom lawsuit popul on last deceas unnam choke keep s nameless susten croak campaign number pop one down suddenli causal unknown support perfectli due live way suit dwell more flat life buy short crusad atom hold with former case bucket up incognita exist region aliv and give chip it agent imput subsist expir have in agenc conk no make idl handl other stagnant discours utterli farm terra unsung unidentifi numb ghost drain off drive quantiti caus the away,9doc4_vital,life full of critic live vital sustain,all strang dead alien in suddenli utter absolut unknown perfectli activ bush short live other stagnant awak earli anim utterli beat terra unsung unidentifi obscur numb deaden alert former drain stranger region oscc abruptli quantiti incognita idl nameless unnam aliv,4doc4_last_fudt,point lastli surviv fini cobbler in go close shoemak out death end live endur termin net final lowest finish conclud stop utmost hold conclus stage on fudt last up s place,,1000doc4_fu_time,metr dimens term fu clip clock sentenc prison meter fourth time,,1000doc4_ajcc4,ajcc4,ane trio one ii littl uniti tercet tetrad deuc foursom three triniti 1 3 2 4 ternari singl trine triplet terzetto quadruplet troika threesom quaternion two iv iii ternion four ace quaternari i trey tierc quatern triad leash quartet joe,4doc4_ajcc2,ajcc2,ane uniti cypher ace i nought one 1 0 zero cipher singl,2doc4_OSCC_death,death last deceas die oscc destruct demis end expiri,ane uniti cypher ace i nought one 1 0 zero cipher singl,2doc4_all_death,all death last deceas altogeth die destruct entir demis total end complet whole expiri wholli,ane uniti cypher ace i nought one 1 0 zero cipher singl,2doc5_Main_identification,independ princip identif recognit chief design master main primari brini,,1000doc5_Cellfile_identificat,identif recognit design cellfil,,1000doc5_Tissue_type,case typecast charact typewrit weav paper tissu type eccentr,elect elementari mucosa membran primari quill tumour convent pattern chief neoplasm master formula feather main normal basal coil mucou rule element tumor princip wind,2doc5_Gender,gender grammat sexual sex,metr chiliad number meter one fluorin concentr farad mib megabyt fahrenheit grand 9 thousand atom molar yard g f thou mebibyt k mb m degre 1000,2doc5_Age_at_major_operati,oper major geezerhood mental process surgeri atom number procedur roy at year old eld cognit 85 perform long mathemat john function matur get period surgic on senesc militari age histor r time astatin,,1000doc5_Centre,and kernel heart centr pore nerv soul nub gist concentr middl eye inward sum essenc core nitti midpoint substanc attent marrow meat center of focu pith gritti rivet,oxford univers manchest,2doc5_Primary_or_recurrenc,oper elect elementari surgeri beaver primari quill chief state master feather main theatr return oregon basal coil recurr theater room element princip or wind,elect elementari chief element basal princip master wind coil feather main primari quill,1doc5_Anatomic_Region,realm area region part neighborhood anatom,earli liter hy cubic lambert oc l litr decimetr other 50 fifti former decimet op,5doc5_Site,web land locat situat site websit place internet,lingua deck clapper over butt parans storey trade piriform utter languag blow prat tonsilla palatin tail tush hind nate cryptoprocta front backtalk rear knock level fissur shock ars dump natur back seat keister out bottom tonsil fanni behind caviti supraglotti knife ass ulterior sinu water base faucial rima ori of genu prior anterior buttock down stern speak aback verbal stori rump spit hypopharynx posterior bun bum mouthpiec derrier glossa coldcock cat can fundament verbalis backsid pit end floor lip take tooshi ball mouth hindquart ferox sass later tooth subglottu tongu fossa the oral talk,doc5_Site_identification,websit land locat web situat site identif recognit design internet place,ane uniti cypher ace i nought one 1 0 zero cipher 2a 2b 2c singl,5doc5_Clinical_T_stage,point tetraiodothyronin metric tonn clinic microscop stagecoach triiodothyronin thyroxin monophosph ton leg liothyronin phase repres present stage thymin level mt degre deoxythymidin t arrang,ane trio one ii littl uniti tercet tetrad deuc foursom three triniti 1 3 2 4 ternari singl trine triplet terzetto quadruplet troika threesom quaternion two iv iii ternion four ace quaternari i trey tierc quatern triad leash quartet joe,4doc5_Clinical_N_stage,nitrogen point newton number repres clinic microscop stagecoach northward leg due 7 north normal atom phase present stage level n degre arrang,ane uniti cypher ace i nought one 1 0 zero cipher 2a 2b 2c singl,5doc5_Nature_of_operation,oper function mental process natur surgeri surgic procedur perform mathemat of militari cognit,,1000doc5_Previous_site,late land old web previou situat site websit place internet locat former prematur,,1000doc5_Previous_stage,point old level previou repres late degre present microscop leg phase arrang stagecoach former prematur stage,,1000doc5_Previous_surgery,oper old room process surgeri previou procedur or late former surgic theater theatr prematur,,1000doc5_Previous_diagnosisT,diagnosist old previou late former prematur,,1000doc5_Previous_chemo,old previou late chemo former prematur,,1000doc5_Previous_disease_not,tone down reserv late feder prematur mark note old music take greenback diseas billet previou notic hand mention promissori letter govern line former bank preemin notat remark short banknot emin of bill annot distinct s banker observ,,1000doc5_Smoke,heater fume pot sen sess mari gage fastbal jane roll hummer dope weed goddess skunk tobacco bullet locowe of green smoke grass,barricad fume over kickoff hitch go passe plosiv showtim arrest scratch discontinu halt get stop initi break embark blockag bar signal antiqu contain ceas x husband set old back jump ex pass out lead current forth full never closur intercept offset come on about occlus dri turn startl block first origin outset depart point period pop down blockad commenc quit stream start electr termin head conson part catch line hold bulg bug kibosh sound hat stoppag up outmod fashion demod give diaphragm cure stopov check end ne speech take er begin finish smoke stay lay off wife flow layov time protrud,4doc5_Alcohol,intoxic drink beverag alcohol inebri,clayey number arduou heavi labori gruell expect heavili wakeless operos er leaden ponder sullen gruel no grave ne intemper labor current labour larg nobelium big threaten more hard toilsom punish never overweight great grievou backbreak weigh sonor child 102 with present sound down lower impenetr alchohol profound dens gravid enceint weighti atom lumber fleshi cloggi,3